{
  "poll_id": "quaest_pe_2026-09-07_stimulated_1st_round",
  "institute_id": "quaest",
  "fieldwork_start": "2026-09-04",
  "fieldwork_end": "2026-09-07",
  "fieldwork_mid": "2026-09-05",
  "geography": "state",
  "uf": "PE",
  "election_cycle": 2026,
  "scenario": "stimulated_1st_round",
  "sample_size": 1302,
  "moe": 0.03,
  "results": {
    "lula": 0.51,
    "flavio_bolsonaro": 0.21,
    "augusto_cury": 0.06,
    "ronaldo_caiado": 0.02,
    "renan_santos": 0.02
  },
  "residuals": {
    "branco_nulo": 0.08,
    "ns_nr": 0.1
  },
  "tse_registration_id": "PE-00285/2026",
  "witness_ids": [
    "w_quaest_states_2026-09-07_g1_1t"
  ],
  "dataset_version": "intake-regional-001",
  "notes": "Regional PE Quaest (Globo). Dual-entered from g1 labeled HTML lists (not Arte images). DF also cites BR-04442/2026 — UF id preferred. PE g1 wording says \"todo o país\" under PE block (likely copy-paste); TSE PE-00285/2026 + UF section used. Never merge into national Option B."
}
