{
  "poll_id": "realtime_bigdata_mg_2026-09-19_stimulated_2nd_round_flavio_bolsonaro_vs_lula",
  "institute_id": "realtime_bigdata",
  "fieldwork_start": "2026-09-16",
  "fieldwork_end": "2026-09-19",
  "fieldwork_mid": "2026-09-17",
  "geography": "state",
  "uf": "MG",
  "election_cycle": 2026,
  "scenario": "stimulated_2nd_round_flavio_bolsonaro_vs_lula",
  "sample_size": 2000,
  "moe": 0.02,
  "results": {
    "flavio_bolsonaro": 0.46,
    "lula": 0.45
  },
  "residuals": {
    "branco_nulo": 0.05,
    "ns_nr": 0.04
  },
  "tse_registration_id": "BR-01531/2026",
  "witness_ids": [
    "w_rtbd_mg_2026-09-19_cnn"
  ],
  "dataset_version": "intake-regional-001",
  "notes": "Regional MG 2º from CNN labeled HTML. Never merge into national Option B."
}
